{"$schema": "http://json-schema.org/schema#", "type": "object", "properties": {"kind": {"type": "string"}, "etag": {"type": "string"}, "items": {"type": "array", "items": {"type": "object", "properties": {"kind": {"type": "string"}, "etag": {"type": "string"}, "id": {"type": "string"}, "snippet": {"type": "object", "properties": {"publishedAt": {"format": "date-time", "type": "string"}, "channelId": {"type": "string"}, "title": {"type": "string"}, "description": {"type": "string"}, "thumbnails": {"type": "object", "properties": {"default": {"type": "object", "properties": {"url": {"type": "string"}, "width": {"type": "integer"}, "height": {"type": "integer"}}, "required": ["height", "url", "width"]}, "medium": {"type": "object", "properties": {"url": {"type": "string"}, "width": {"type": "integer"}, "height": {"type": "integer"}}, "required": ["height", "url", "width"]}, "high": {"type": "object", "properties": {"url": {"type": "string"}, "width": {"type": "integer"}, "height": {"type": "integer"}}, "required": ["height", "url", "width"]}, "standard": {"type": "object", "properties": {"url": {"type": "string"}, "width": {"type": "integer"}, "height": {"type": "integer"}}, "required": ["height", "url", "width"]}, "maxres": {"type": "object", "properties": {"url": {"type": "string"}, "width": {"type": "integer"}, "height": {"type": "integer"}}, "required": ["height", "url", "width"]}}, "required": ["default", "high", "medium"]}, "channelTitle": {"type": "string"}, "tags": {"type": "array", "items": {"type": "string"}}, "categoryId": {"type": "string"}, "liveBroadcastContent": {"type": "string"}, "defaultLanguage": {"type": "string"}, "localized": {"type": "object", "properties": {"title": {"type": "string"}, "description": {"type": "string"}}, "required": ["description", "title"]}, "defaultAudioLanguage": {"type": "string"}}, "required": ["categoryId", "channelId", "channelTitle", "defaultLanguage", "description", "liveBroadcastContent", "localized", "publishedAt", "tags", "thumbnails", "title"]}, "contentDetails": {"type": "object", "properties": {"duration": {"format": "duration", "type": "string"}, "dimension": {"anyOf": [{"type": "string"}, {"format": "duration", "type": "string"}]}, "definition": {"type": "string"}, "caption": {"type": "string"}, "licensedContent": {"type": "boolean"}, "contentRating": {"type": "object", "properties": {"ytRating": {"type": "string"}}}, "projection": {"type": "string"}, "regionRestriction": {"type": "object", "properties": {"allowed": {"type": "array", "items": {"type": "string"}}}, "required": ["allowed"]}}, "required": ["caption", "contentRating", "definition", "dimension", "duration", "licensedContent", "projection"]}, "status": {"type": "object", "properties": {"uploadStatus": {"type": "string"}, "privacyStatus": {"type": "string"}, "license": {"type": "string"}, "embeddable": {"type": "boolean"}, "publicStatsViewable": {"type": "boolean"}, "madeForKids": {"type": "boolean"}}, "required": ["embeddable", "license", "madeForKids", "privacyStatus", "publicStatsViewable", "uploadStatus"]}, "statistics": {"type": "object", "properties": {"viewCount": {"type": "string"}, "likeCount": {"type": "string"}, "favoriteCount": {"type": "string"}, "commentCount": {"type": "string"}}, "required": ["commentCount", "favoriteCount", "likeCount", "viewCount"]}, "player": {"type": "object", "properties": {"embedHtml": {"type": "string"}}, "required": ["embedHtml"]}, "recordingDetails": {"type": "object", "properties": {"locationDescription": {"type": "string"}, "location": {"type": "object", "properties": {"latitude": {"type": "number"}, "longitude": {"type": "number"}, "altitude": {"type": "integer"}}, "required": ["altitude", "latitude", "longitude"]}, "recordingDate": {"format": "date-time", "type": "string"}}}, "localizations": {"type": "object", "properties": {"de": {"type": "object", "properties": {"title": {"type": "string"}, "description": {"type": "string"}}, "required": ["description", "title"]}, "en": {"type": "object", "properties": {"title": {"type": "string"}, "description": {"type": "string"}}, "required": ["description", "title"]}, "ru": {"type": "object", "properties": {"title": {"type": "string"}, "description": {"type": "string"}}, "required": ["description", "title"]}, "ja": {"type": "object", "properties": {"title": {"type": "string"}, "description": {"type": "string"}}, "required": ["description", "title"]}}, "required": ["en"]}, "paidProductPlacementDetails": {"type": "object", "properties": {"hasPaidProductPlacement": {"type": "boolean"}}, "required": ["hasPaidProductPlacement"]}, "topicDetails": {"type": "object", "properties": {"topicCategories": {"type": "array", "items": {"type": "string"}}}, "required": ["topicCategories"]}, "liveStreamingDetails": {"type": "object", "properties": {"activeLiveChatId": {"type": "string"}, "actualStartTime": {"type": "string", "format": "date-time"}, "actualEndTime": {"type": "string", "format": "date-time"}, "scheduledStartTime": {"type": "string", "format": "date-time"}}}}, "required": ["contentDetails", "etag", "id", "kind", "localizations", "paidProductPlacementDetails", "player", "recordingDetails", "snippet", "statistics", "status"]}}, "pageInfo": {"type": "object", "properties": {"totalResults": {"type": "integer"}, "resultsPerPage": {"type": "integer"}}, "required": ["resultsPerPage", "totalResults"]}}, "required": ["etag", "items", "kind", "pageInfo"]}
