{
  "kind": "youtube#videoListResponse",
  "etag": "7DKekg8h9s2DSsll0ZI4kn9bDUo",
  "items": [
    {
      "kind": "youtube#video",
      "etag": "MYjvrw3tObX23cGOungmQBPGQmw",
      "id": "jNQXAC9IVRw",
      "snippet": {
        "publishedAt": "2005-04-24T03:31:52Z",
        "channelId": "UC4QobU6STFB0P71PMvOGN5A",
        "title": "Me at the zoo",
        "description": "Microplastics are accumulating in human brains at an alarming rate\nhttps://www.youtube.com/watch?v=0PT5c1z3LL8\n\n\u201cNanoplastics and Human Health\u201d with Matthew J Campen, PhD, MSPH\nhttps://www.youtube.com/watch?v=RRBN_4L09Mg\n\n00:00 Intro\n00:05 The cool thing\n00:17 End",
        "thumbnails": {
          "default": {
            "url": "https://i.ytimg.com/vi/jNQXAC9IVRw/default.jpg",
            "width": 120,
            "height": 90
          },
          "medium": {
            "url": "https://i.ytimg.com/vi/jNQXAC9IVRw/mqdefault.jpg",
            "width": 320,
            "height": 180
          },
          "high": {
            "url": "https://i.ytimg.com/vi/jNQXAC9IVRw/hqdefault.jpg",
            "width": 480,
            "height": 360
          }
        },
        "channelTitle": "jawed",
        "tags": [
          "me at the zoo",
          "jawed karim",
          "first youtube video"
        ],
        "categoryId": "1",
        "liveBroadcastContent": "none",
        "defaultLanguage": "en",
        "localized": {
          "title": "Me at the zoo",
          "description": "Microplastics are accumulating in human brains at an alarming rate\nhttps://www.youtube.com/watch?v=0PT5c1z3LL8\n\n\u201cNanoplastics and Human Health\u201d with Matthew J Campen, PhD, MSPH\nhttps://www.youtube.com/watch?v=RRBN_4L09Mg\n\n00:00 Intro\n00:05 The cool thing\n00:17 End"
        },
        "defaultAudioLanguage": "en"
      },
      "contentDetails": {
        "duration": "PT19S",
        "dimension": "2d",
        "definition": "hd",
        "caption": "true",
        "licensedContent": true,
        "contentRating": {},
        "projection": "rectangular"
      },
      "status": {
        "uploadStatus": "processed",
        "privacyStatus": "public",
        "license": "youtube",
        "embeddable": true,
        "publicStatsViewable": false,
        "madeForKids": false
      },
      "statistics": {
        "viewCount": "405489293",
        "likeCount": "19385941",
        "favoriteCount": "0",
        "commentCount": "10564687"
      },
      "player": {
        "embedHtml": "<iframe width=\"480\" height=\"360\" src=\"//www.youtube.com/embed/jNQXAC9IVRw\" frameborder=\"0\" allow=\"accelerometer; autoplay; clipboard-write; encrypted-media; gyroscope; picture-in-picture; web-share\" referrerpolicy=\"strict-origin-when-cross-origin\" allowfullscreen></iframe>"
      },
      "recordingDetails": {
        "locationDescription": "San Diego Zoo",
        "location": {
          "latitude": 32.7360353,
          "longitude": -117.1509849,
          "altitude": 0
        },
        "recordingDate": "2005-04-23T00:00:00Z"
      },
      "localizations": {
        "de": {
          "title": "Ich im Zoo",
          "description": "Das erste YouTube video. Vielleicht ist es Zeit zum Zoo zur\u00fcckzukehren?\n\n00:00 Intro\n00:05 Das coole Ding\n00:17 Ende"
        },
        "en": {
          "title": "Me at the zoo",
          "description": "Microplastics are accumulating in human brains at an alarming rate\nhttps://www.youtube.com/watch?v=0PT5c1z3LL8\n\n\u201cNanoplastics and Human Health\u201d with Matthew J Campen, PhD, MSPH\nhttps://www.youtube.com/watch?v=RRBN_4L09Mg\n\n00:00 Intro\n00:05 The cool thing\n00:17 End"
        }
      },
      "paidProductPlacementDetails": {
        "hasPaidProductPlacement": false
      }
    }
  ],
  "pageInfo": {
    "totalResults": 1,
    "resultsPerPage": 1
  }
}