{
  "kind": "youtube#videoListResponse",
  "etag": "M5T8M5eOSZq1F41ER4eBc9Xj90o",
  "items": [
    {
      "kind": "youtube#video",
      "etag": "AK5RyLQSzProTficjrSm16L0PaU",
      "id": "jNQXAC9IVRw",
      "snippet": {
        "publishedAt": "2005-04-24T03:31:52Z",
        "channelId": "UC4QobU6STFB0P71PMvOGN5A",
        "title": "Me at the zoo",
        "description": "Microplastics are accumulating in human brains at an alarming rate\nhttps://www.youtube.com/watch?v=0PT5c1z3LL8\n\n“Nanoplastics and Human Health” with Matthew J Campen, PhD, MSPH\nhttps://www.youtube.com/watch?v=RRBN_4L09Mg\n\n00:00 Intro\n00:05 The cool thing\n00:17 End",
        "thumbnails": {
          "default": {
            "url": "https://i.ytimg.com/vi/jNQXAC9IVRw/default.jpg",
            "width": 120,
            "height": 90
          },
          "medium": {
            "url": "https://i.ytimg.com/vi/jNQXAC9IVRw/mqdefault.jpg",
            "width": 320,
            "height": 180
          },
          "high": {
            "url": "https://i.ytimg.com/vi/jNQXAC9IVRw/hqdefault.jpg",
            "width": 480,
            "height": 360
          }
        },
        "channelTitle": "jawed",
        "tags": [
          "me at the zoo",
          "jawed karim",
          "first youtube video"
        ],
        "categoryId": "1",
        "liveBroadcastContent": "none",
        "defaultLanguage": "en",
        "localized": {
          "title": "Me at the zoo",
          "description": "Microplastics are accumulating in human brains at an alarming rate\nhttps://www.youtube.com/watch?v=0PT5c1z3LL8\n\n“Nanoplastics and Human Health” with Matthew J Campen, PhD, MSPH\nhttps://www.youtube.com/watch?v=RRBN_4L09Mg\n\n00:00 Intro\n00:05 The cool thing\n00:17 End"
        },
        "defaultAudioLanguage": "en"
      },
      "contentDetails": {
        "duration": "PT19S",
        "dimension": "2d",
        "definition": "hd",
        "caption": "true",
        "licensedContent": true,
        "contentRating": {},
        "projection": "rectangular"
      },
      "status": {
        "uploadStatus": "processed",
        "privacyStatus": "public",
        "license": "youtube",
        "embeddable": true,
        "publicStatsViewable": false,
        "madeForKids": false
      },
      "statistics": {
        "viewCount": "405867021",
        "likeCount": "19398480",
        "favoriteCount": "0",
        "commentCount": "10566535"
      },
      "player": {
        "embedHtml": "\u003ciframe width=\"480\" height=\"360\" src=\"//www.youtube.com/embed/jNQXAC9IVRw\" frameborder=\"0\" allow=\"accelerometer; autoplay; clipboard-write; encrypted-media; gyroscope; picture-in-picture; web-share\" referrerpolicy=\"strict-origin-when-cross-origin\" allowfullscreen\u003e\u003c/iframe\u003e"
      },
      "recordingDetails": {
        "locationDescription": "San Diego Zoo",
        "location": {
          "latitude": 32.7360353,
          "longitude": -117.1509849,
          "altitude": 0
        },
        "recordingDate": "2005-04-23T00:00:00Z"
      },
      "localizations": {
        "en": {
          "title": "Me at the zoo",
          "description": "Microplastics are accumulating in human brains at an alarming rate\nhttps://www.youtube.com/watch?v=0PT5c1z3LL8\n\n“Nanoplastics and Human Health” with Matthew J Campen, PhD, MSPH\nhttps://www.youtube.com/watch?v=RRBN_4L09Mg\n\n00:00 Intro\n00:05 The cool thing\n00:17 End"
        },
        "de": {
          "title": "Ich im Zoo",
          "description": "Das erste YouTube video. Vielleicht ist es Zeit zum Zoo zurückzukehren?\n\n00:00 Intro\n00:05 Das coole Ding\n00:17 Ende"
        }
      },
      "paidProductPlacementDetails": {
        "hasPaidProductPlacement": false
      }
    }
  ],
  "pageInfo": {
    "totalResults": 1,
    "resultsPerPage": 1
  }
}
